{
  "$schema": "../schema/exercise-data.schema.json",
  "schemaVersion": 1,
  "metadata": {
    "id": "lemon_exercises",
    "title": "Lemon Exercise Data",
    "description": "Shared exercise catalog and sessions extracted from the Android app and browser JSON plans.",
    "revision": 1,
    "locale": "en",
    "extensions": {
      "muscleGroups": [
        "abs",
        "back",
        "biceps",
        "calves",
        "chest",
        "forearms",
        "glutes",
        "hamstrings",
        "hands",
        "hip_abductors",
        "quadriceps",
        "rear_delts",
        "shoulders",
        "triceps"
      ]
    }
  },
  "exerciseCatalog": {
    "elliptical": {
      "title": "Elliptical",
      "kind": "activity",
      "parameters": {
        "mode": "elliptical",
        "durationMinutes": 5,
        "level": 10,
        "totalSets": 1,
        "restFinalSeconds": 120
      },
      "settings": {
        "setupNote": "Вес: 85 кг (190 lb). Возраст: 55. Максимальный пульс: 140. Установите уровень 10. Положите кисти на центральные неподвижные поручни. Локти расслаблены и опущены вниз. Не тяните и не толкайте руками."
      }
    },
    "elliptical_no_arms": {
      "title": "Elliptical",
      "kind": "activity",
      "parameters": {
        "mode": "elliptical",
        "durationMinutes": 5,
        "level": 10,
        "totalSets": 1,
        "restFinalSeconds": 120
      },
      "settings": {
        "setupNote": "Держитесь за неподвижные центральные поручни. Локти опущены и расслаблены. Работают только ноги."
      }
    },
    "leg_press": {
      "title": "Leg Press",
      "kind": "weights",
      "parameters": {
        "weightOptions": [
          16,
          23,
          30,
          37,
          44,
          51,
          58,
          65,
          72,
          79,
          86,
          93,
          100
        ],
        "defaultWeight": 51,
        "totalSets": 3,
        "restBetweenSeconds": 45,
        "restFinalSeconds": 120
      },
      "settings": {
        "setupNote": "Перед началом установите длину салазок на позицию 8. Руками за боковые рукояти держитесь мягко, без напряжения в локтях."
      },
      "muscleGroups": [
        "quadriceps",
        "glutes"
      ]
    },
    "leg_extension": {
      "title": "Leg Extension",
      "kind": "weights",
      "parameters": {
        "weightOptions": [
          7,
          12,
          14,
          19,
          21,
          26,
          28,
          35,
          42,
          49,
          56,
          63,
          70,
          77,
          84,
          91
        ],
        "defaultWeight": 21,
        "totalSets": 3,
        "restBetweenSeconds": 45,
        "restFinalSeconds": 120
      },
      "settings": {
        "setupNote": "Спинку зафиксируйте в пазе 5, валик для ног поставьте в положение XL."
      },
      "muscleGroups": [
        "quadriceps"
      ]
    },
    "leg_curl": {
      "title": "Leg Curl",
      "kind": "weights",
      "parameters": {
        "weightOptions": [
          7,
          14,
          21,
          28,
          35,
          42,
          49,
          56,
          63,
          70,
          77,
          84,
          91
        ],
        "defaultWeight": 21,
        "totalSets": 3,
        "restBetweenSeconds": 45,
        "restFinalSeconds": 120
      },
      "settings": {
        "setupNote": "Перед упражнением установите валик для ног в положение XL."
      },
      "muscleGroups": [
        "hamstrings"
      ]
    },
    "leg_abductor": {
      "title": "Hip abductor",
      "kind": "weights",
      "parameters": {
        "weightOptions": [
          14,
          21,
          28,
          35,
          42,
          49,
          56,
          63
        ],
        "defaultWeight": 63,
        "totalSets": 3,
        "restBetweenSeconds": 45,
        "restFinalSeconds": 120
      },
      "settings": {
        "setupNote": "Установите начальную ширину в положение 1."
      },
      "muscleGroups": [
        "hip_abductors"
      ]
    },
    "shoulder_press": {
      "title": "Shoulder Press",
      "kind": "weights",
      "parameters": {
        "weightOptions": [
          7,
          14,
          21,
          28,
          35,
          42,
          49,
          56,
          63,
          70,
          77,
          84,
          91
        ],
        "defaultWeight": 21,
        "totalSets": 3,
        "restBetweenSeconds": 60,
        "restFinalSeconds": 120
      },
      "settings": {
        "setupNote": "Отрегулируйте высоту сиденья на уровень 8."
      },
      "muscleGroups": [
        "shoulders"
      ]
    },
    "lat_pulldown": {
      "title": "Lat Pulldown",
      "kind": "weights",
      "parameters": {
        "weightOptions": [
          7,
          14,
          21,
          28,
          35,
          42,
          49
        ],
        "defaultWeight": 49,
        "totalSets": 3,
        "restBetweenSeconds": 60,
        "restFinalSeconds": 120
      },
      "settings": {
        "setupNote": "Перед тягой установите высоту сиденья на уровень 5."
      },
      "muscleGroups": [
        "back"
      ]
    },
    "chest_press": {
      "title": "Chest Press",
      "kind": "weights",
      "parameters": {
        "weightOptions": [
          7,
          14,
          21,
          28,
          35,
          42,
          49,
          56,
          63,
          70,
          77,
          84,
          91
        ],
        "defaultWeight": 28,
        "totalSets": 3,
        "restBetweenSeconds": 45,
        "restFinalSeconds": 120
      },
      "settings": {
        "setupNote": "Отрегулируйте высоту сиденья на уровень 4 и убедитесь, что руки выстроены ровно."
      },
      "muscleGroups": [
        "chest"
      ]
    },
    "row": {
      "title": "Row",
      "kind": "weights",
      "parameters": {
        "weightOptions": [
          60
        ],
        "defaultWeight": 60,
        "totalSets": 3,
        "restBetweenSeconds": 45,
        "restFinalSeconds": 120,
        "weightLabel": "2x30кг"
      },
      "muscleGroups": [
        "back"
      ]
    },
    "pec_deck": {
      "title": "Pec Deck / Butterfly",
      "kind": "weights",
      "parameters": {
        "weightOptions": [
          7,
          14,
          21,
          28,
          35,
          42,
          49,
          56,
          63,
          70,
          77,
          84,
          91
        ],
        "defaultWeight": 35,
        "totalSets": 3,
        "restBetweenSeconds": 45,
        "restFinalSeconds": 120
      },
      "settings": {
        "setupNote": "Сядь так, чтобы рукояти были на уровне середины груди. Спину плотно прижми к спинке, грудь раскрой, плечи опусти вниз. Используй легкий вес, который позволяет выполнять движение плавно и сохранять полное сокращение в каждом повторении.\n\nМедленно своди рукояти перед собой примерно за 3 секунды. В конечной точке удерживай их вместе 2-3 секунды и максимально напрягай грудные мышцы.\n\nЗатем так же медленно разводи руки обратно примерно за 3 секунды. Не бросай вес, не раскачивай корпус и сохраняй локти в фиксированном положении на протяжении всего подхода."
      },
      "muscleGroups": [
        "chest"
      ]
    },
    "cable_crunch": {
      "title": "Abdominal Cable Crunch",
      "kind": "weights",
      "parameters": {
        "weightOptions": [
          14,
          21,
          28,
          35,
          42,
          49,
          56,
          63,
          70
        ],
        "defaultWeight": 35,
        "totalSets": 3,
        "restBetweenSeconds": 45,
        "restFinalSeconds": 120
      },
      "settings": {
        "setupNote": "Пресс в кроссовере:\nСядьте спиной или лицом к блоку, возьмитесь за канат. ПЛОТНО прижмите кисти к шее/плечам. Локти зафиксируйте вдоль туловища. Наклоняйтесь вниз ТОЛЬКО за счет сокращения пресса. Руки и локти остаются абсолютно неподвижными относительно корпуса."
      },
      "muscleGroups": [
        "abs"
      ]
    },
    "decline_bench_crunch": {
      "title": "Decline Bench Crunch",
      "kind": "repetitions",
      "description": "Скручивания на наклонной скамье. Скрестите руки на груди (поза мумии). Поднимайте туловище за счет пресса. Исключите руки из движения.",
      "parameters": {
        "repetitions": "12-15"
      },
      "muscleGroups": [
        "abs"
      ]
    },
    "floor_crunch": {
      "title": "Floor Crunch",
      "kind": "repetitions",
      "description": "Скручивания на полу\n\nЛягте на коврик, ноги согнуты. Руки скрещены на груди. Плавно отрывайте лопатки от пола, поясница прижата.",
      "parameters": {
        "repetitions": "15-20"
      },
      "muscleGroups": [
        "abs"
      ]
    },
    "db_front_raise": {
      "title": "Dumbbell Front Raise",
      "kind": "weights",
      "parameters": {
        "weightOptions": [
          2,
          3,
          4,
          5,
          6,
          7,
          8,
          9,
          10
        ],
        "defaultWeight": 3,
        "totalSets": 3,
        "restBetweenSeconds": 45,
        "restFinalSeconds": 120
      },
      "settings": {
        "setupNote": "Подъемы гантелей перед собой\n\nВстаньте прямо. Гантели в опущенных руках перед бедрами. Хват пронированный: ладони смотрят на бедра, тыльная сторона кисти направлена вперед. Зафиксируйте локти почти прямыми (угол сгиба 5-10 градусов для снятия нагрузки с сустава). Не меняя угла в локте, поднимите гантели перед собой до уровня плеч. Опускайте плавно."
      },
      "muscleGroups": [
        "shoulders"
      ]
    },
    "db_lateral_raise": {
      "title": "Dumbbell Lateral Raise",
      "kind": "weights",
      "parameters": {
        "weightOptions": [
          2,
          3,
          4,
          5,
          6,
          7,
          8,
          9,
          10
        ],
        "defaultWeight": 3,
        "totalSets": 3,